{
  "$schema": "http://json-schema.org/draft-07/schema#",
  "$id": "source.schema.json",
  "title": "WebMapX Layer Repository — Harvest Source",
  "description": "A curated pointer to somewhere layers can be read from automatically. This is the hand-maintained part of the catalog: reviewing one means judging whether an endpoint is worth trusting, which a person can do — as opposed to eyeballing the thousands of layer records it yields, which nobody can. Everything downstream is generated into harvested/ and is not in git.",
  "type": "object",
  "required": [
    "id",
    "type",
    "url",
    "provider"
  ],
  "properties": {
    "id": {
      "type": "string",
      "description": "Slug, unique across sources/"
    },
    "title": {
      "type": "string"
    },
    "type": {
      "type": "string",
      "enum": [
        "wms-capabilities",
        "wmts-capabilities",
        "wfs-capabilities",
        "pdok-plugin-list",
        "ogc-api-records"
      ],
      "description": "How to read this source. Self-describing services (WMS/WMTS GetCapabilities, OGC API) versus third-party catalogues that already did the harvesting, of which the QGIS PDOK plugin's layer list is one."
    },
    "url": {
      "type": "string",
      "description": "Where to read it. A capabilities document, or the catalogue file itself."
    },
    "provider": {
      "type": "object",
      "required": [
        "id",
        "name"
      ],
      "description": "Who the harvested layers belong to. Read off the source rather than inferred from its hostname, because a catalogue or cache is not the provider of what it lists.",
      "properties": {
        "id": {
          "type": "string"
        },
        "name": {
          "type": "string"
        },
        "url": {
          "type": "string"
        },
        "operator": {
          "type": "object",
          "additionalProperties": true
        },
        "license": {
          "type": "string"
        },
        "access": {
          "type": "string",
          "enum": [
            "free",
            "api-key",
            "paid",
            "registration"
          ],
          "default": "free"
        },
        "categories": {
          "type": "array",
          "items": {
            "type": "string"
          },
          "description": "Themes the provider's layers cover. Carried through to the harvested provider record; harvesting cannot infer it from a capabilities document."
        },
        "attribution": {
          "type": "string",
          "description": "Credit line every harvested layer carries, written into webmapxConfig.source.attribution. Set it when the licensor dictates the wording — CC BY licences do. {year} resolves at harvest time. Left out, one is built from the provider's name, url and licence."
        }
      }
    },
    "region": {
      "type": "string",
      "description": "Path under layers/ the output belongs to, e.g. world/europe/netherlands"
    },
    "bounds": {
      "type": "array",
      "minItems": 4,
      "maxItems": 4,
      "items": {
        "type": "number"
      },
      "description": "Geographic extent [west, south, east, north] of everything this source serves. Written onto every harvested layer, so a client can frame it: a national dataset shown at a world zoom reads as blank rather than as data. Capabilities documents carry per-layer bounding boxes, but third-party catalogues generally do not, so this is stated once here."
    },
    "maintainer": {
      "type": "string",
      "description": "Who keeps the source itself current. That a list is maintained by a known person is a fact about the source, not about each layer in it."
    },
    "note": {
      "type": "string"
    },
    "include": {
      "type": "object",
      "description": "Which of the source's layers to take. A capabilities document usually offers far more than is worth publishing.",
      "properties": {
        "serviceTypes": {
          "type": "array",
          "items": {
            "type": "string"
          },
          "description": "Default: those a web map can render (wms, wmts, api tiles)"
        },
        "crs": {
          "type": "string",
          "default": "EPSG:3857",
          "description": "Drop layers the service cannot deliver in this CRS"
        },
        "match": {
          "type": "string",
          "description": "Regular expression the layer name or title must match"
        },
        "exclude": {
          "type": "string",
          "description": "Regular expression that disqualifies a layer"
        },
        "limit": {
          "type": "integer",
          "description": "Cap on layers taken, for a first pass at a very large source"
        },
        "enrich": {
          "type": "boolean",
          "description": "Set false to skip legend and attribute enrichment for this source. Attribute schemas cost one request per layer, so a service offering tens of thousands of layers is left unenriched rather than hammered on every harvest."
        },
        "expandStyles": {
          "type": "boolean",
          "description": "Set false to keep a layer with several published WMS styles as one layer. Default is to expand: a style is a different rendering of the same source, which is what a layer is."
        }
      }
    },
    "enabled": {
      "type": "boolean",
      "default": true
    }
  }
}
