{
  "id": "ign-es-pnoa",
  "title": "IGN España PNOA orthoimagery WMS",
  "type": "wms-capabilities",
  "url": "https://www.ign.es/wms-inspire/pnoa-ma?SERVICE=WMS&VERSION=1.3.0&REQUEST=GetCapabilities",
  "note": "PNOA máxima actualidad: the most recent national aerial coverage, falling back to Sentinel-2 where no orthophoto is flown. Same provider as ign-es-base, different service.",
  "provider": {
    "id": "ign-es",
    "name": "Instituto Geográfico Nacional (IGN)",
    "url": "https://www.ign.es",
    "license": "CC-BY-4.0",
    "access": "free",
    "attribution": "© Instituto Geográfico Nacional de España",
    "operator": {
      "type": "government",
      "country": "ES"
    },
    "categories": [
      "satellite",
      "aerial"
    ]
  },
  "region": "world/europe/spain",
  "include": { "crs": "EPSG:3857" },
  "enabled": true,
  "bounds": [-18.2, 27.5, 4.4, 44.0]
}
